[2025-08-19T08:07:34.338Z] [local] [INFO] === Local Feed Fetcher Started ===
[2025-08-19T08:07:34.339Z] [local] [INFO] Current working directory: /home/bhuvanesh/paper trails
[2025-08-19T08:07:34.339Z] [local] [INFO] Script directory: /home/bhuvanesh/paper trails/src/scripts
[2025-08-19T08:07:34.380Z] [local] [INFO] Found 53 Substack feeds and 75 other feeds
[2025-08-19T08:07:34.381Z] [local] [INFO] [1/128] Starting fetch: Aeon
[2025-08-19T08:07:34.936Z] [local] [INFO] ✅ Aeon: 20 items, 10 new articles
[2025-08-19T08:07:34.936Z] [local] [INFO] ⏱ Waiting 5 seconds...
[2025-08-19T08:07:39.936Z] [local] [INFO] [2/128] Starting fetch: Epsilon Theory
[2025-08-19T08:07:41.493Z] [local] [INFO] ✅ Epsilon Theory: 10 items, 10 new articles
[2025-08-19T08:07:41.493Z] [local] [INFO] ⏱ Waiting 5 seconds...
[2025-08-19T08:07:46.494Z] [local] [INFO] [3/128] Starting fetch: Jack Clark
[2025-08-19T08:07:47.373Z] [local] [INFO] ✅ Jack Clark: 10 items, 10 new articles
[2025-08-19T08:07:47.373Z] [local] [INFO] ⏱ Waiting 5 seconds...
[2025-08-19T08:07:52.373Z] [local] [INFO] [4/128] Starting fetch: Jacobin
[2025-08-19T08:07:53.634Z] [local] [INFO] ✅ Jacobin: 20 items, 10 new articles
[2025-08-19T08:07:53.635Z] [local] [INFO] ⏱ Waiting 5 seconds...
[2025-08-19T08:07:58.635Z] [local] [INFO] [5/128] Starting fetch: Simon Sarris
[2025-08-19T08:07:59.035Z] [local] [INFO] ✅ Simon Sarris: 20 items, 10 new articles
[2025-08-19T08:07:59.035Z] [local] [INFO] ⏱ Waiting 5 seconds...
[2025-08-19T08:08:04.035Z] [local] [INFO] [6/128] Starting fetch: Nautilus
[2025-08-19T08:08:04.235Z] [local] [INFO] ✅ Nautilus: 10 items, 10 new articles
[2025-08-19T08:08:04.235Z] [local] [INFO] ⏱ Waiting 5 seconds...
[2025-08-19T08:08:09.235Z] [local] [INFO] [7/128] Starting fetch: New Left Review
[2025-08-19T08:08:10.245Z] [local] [INFO] ✅ New Left Review: 7 items, 7 new articles
[2025-08-19T08:08:10.245Z] [local] [INFO] ⏱ Waiting 5 seconds...
[2025-08-19T08:08:15.245Z] [local] [INFO] [8/128] Starting fetch: Roots of Progress
[2025-08-19T08:08:15.773Z] [local] [INFO] ✅ Roots of Progress: 20 items, 10 new articles
[2025-08-19T08:08:15.773Z] [local] [INFO] ⏱ Waiting 5 seconds...
[2025-08-19T08:08:20.773Z] [local] [INFO] [9/128] Starting fetch: The Leading Edge
[2025-08-19T08:08:21.232Z] [local] [INFO] ✅ The Leading Edge: 20 items, 10 new articles
[2025-08-19T08:08:21.233Z] [local] [INFO] ⏱ Waiting 5 seconds...
[2025-08-19T08:08:26.233Z] [local] [INFO] [10/128] Starting fetch: The Way of Work
[2025-08-19T08:08:26.591Z] [local] [INFO] ✅ The Way of Work: 20 items, 10 new articles
[2025-08-19T08:08:26.591Z] [local] [INFO] ⏱ Waiting 5 seconds...
[2025-08-19T08:08:31.591Z] [local] [INFO] [11/128] Starting fetch: Palladium
[2025-08-19T08:08:32.583Z] [local] [INFO] ✅ Palladium: 18 items, 10 new articles
[2025-08-19T08:08:32.583Z] [local] [INFO] ⏱ Waiting 5 seconds...
[2025-08-19T08:08:37.584Z] [local] [INFO] [12/128] Starting fetch: Protocolized
[2025-08-19T08:08:37.856Z] [local] [INFO] ✅ Protocolized: 20 items, 10 new articles
[2025-08-19T08:08:37.856Z] [local] [INFO] ⏱ Waiting 5 seconds...
[2025-08-19T08:08:42.856Z] [local] [INFO] [13/128] Starting fetch: Psyche
[2025-08-19T08:08:43.075Z] [local] [INFO] ✅ Psyche: 20 items, 10 new articles
[2025-08-19T08:08:43.075Z] [local] [INFO] ⏱ Waiting 5 seconds...
[2025-08-19T08:08:48.076Z] [local] [INFO] [14/128] Starting fetch: Small Potatoes
[2025-08-19T08:08:48.526Z] [local] [INFO] ✅ Small Potatoes: 20 items, 10 new articles
[2025-08-19T08:08:48.526Z] [local] [INFO] ⏱ Waiting 5 seconds...
[2025-08-19T08:08:53.527Z] [local] [INFO] [15/128] Starting fetch: The Side View
[2025-08-19T08:08:55.354Z] [local] [INFO] ✅ The Side View: 10 items, 10 new articles
[2025-08-19T08:08:55.354Z] [local] [INFO] ⏱ Waiting 5 seconds...
[2025-08-19T08:09:00.355Z] [local] [INFO] [16/128] Starting fetch: Africanist Perspective
[2025-08-19T08:09:00.749Z] [local] [INFO] ✅ Africanist Perspective: 20 items, 10 new articles
[2025-08-19T08:09:00.749Z] [local] [INFO] ⏱ Waiting 5 seconds...
[2025-08-19T08:09:05.750Z] [local] [INFO] [17/128] Starting fetch: Age of Invention
[2025-08-19T08:09:05.998Z] [local] [INFO] ✅ Age of Invention: 20 items, 10 new articles
[2025-08-19T08:09:05.998Z] [local] [INFO] ⏱ Waiting 5 seconds...
[2025-08-19T08:09:10.997Z] [local] [INFO] [18/128] Starting fetch: Astral Codex Ten
[2025-08-19T08:09:11.245Z] [local] [INFO] ✅ Astral Codex Ten: 20 items, 10 new articles
[2025-08-19T08:09:11.245Z] [local] [INFO] ⏱ Waiting 5 seconds...
[2025-08-19T08:09:16.246Z] [local] [INFO] [19/128] Starting fetch: Cluny Journal
[2025-08-19T08:09:16.622Z] [local] [INFO] ✅ Cluny Journal: 20 items, 10 new articles
[2025-08-19T08:09:16.622Z] [local] [INFO] ⏱ Waiting 5 seconds...
[2025-08-19T08:09:21.622Z] [local] [INFO] [20/128] Starting fetch: Common Reader
[2025-08-19T08:09:22.062Z] [local] [INFO] ✅ Common Reader: 20 items, 10 new articles
[2025-08-19T08:09:22.063Z] [local] [INFO] ⏱ Waiting 5 seconds...
[2025-08-19T08:09:27.062Z] [local] [INFO] [21/128] Starting fetch: Construction Physics
[2025-08-19T08:09:27.382Z] [local] [INFO] ✅ Construction Physics: 20 items, 10 new articles
[2025-08-19T08:09:27.382Z] [local] [INFO] ⏱ Waiting 5 seconds...
[2025-08-19T08:09:32.383Z] [local] [INFO] [22/128] Starting fetch: Experimental History
[2025-08-19T08:09:32.700Z] [local] [INFO] ✅ Experimental History: 20 items, 10 new articles
[2025-08-19T08:09:32.700Z] [local] [INFO] ⏱ Waiting 5 seconds...
[2025-08-19T08:09:37.700Z] [local] [INFO] [23/128] Starting fetch: Garbage Day
[2025-08-19T08:09:40.516Z] [local] [INFO] Retrying Garbage Day in 30s (attempt 2)
[2025-08-19T08:10:12.272Z] [local] [INFO] Retrying Garbage Day in 60s (attempt 3)
[2025-08-19T08:11:14.402Z] [local] [ERROR] ❌ Garbage Day: Invalid character in entity name
Line: 107
Column: 938
Char: &
[2025-08-19T08:11:14.402Z] [local] [INFO] ⏱ Waiting 5 seconds...
[2025-08-19T08:11:19.403Z] [local] [INFO] [24/128] Starting fetch: Henrik Karlsson
[2025-08-19T08:11:19.675Z] [local] [INFO] ✅ Henrik Karlsson: 20 items, 10 new articles
[2025-08-19T08:11:19.676Z] [local] [INFO] ⏱ Waiting 5 seconds...
[2025-08-19T08:11:24.675Z] [local] [INFO] [25/128] Starting fetch: The Honest Broker
[2025-08-19T08:11:25.088Z] [local] [INFO] ✅ The Honest Broker: 20 items, 10 new articles
[2025-08-19T08:11:25.088Z] [local] [INFO] ⏱ Waiting 5 seconds...
[2025-08-19T08:11:30.088Z] [local] [INFO] [26/128] Starting fetch: Silver Bulletin
[2025-08-19T08:11:30.263Z] [local] [INFO] ✅ Silver Bulletin: 20 items, 10 new articles
[2025-08-19T08:11:30.263Z] [local] [INFO] ⏱ Waiting 5 seconds...
[2025-08-19T08:11:35.264Z] [local] [INFO] [27/128] Starting fetch: Noahpinion
[2025-08-19T08:11:35.711Z] [local] [INFO] ✅ Noahpinion: 20 items, 10 new articles
[2025-08-19T08:11:35.711Z] [local] [INFO] ⏱ Waiting 5 seconds...
[2025-08-19T08:11:40.711Z] [local] [INFO] [28/128] Starting fetch: Noema
[2025-08-19T08:11:42.026Z] [local] [INFO] ✅ Noema: 10 items, 10 new articles
[2025-08-19T08:11:42.027Z] [local] [INFO] ⏱ Waiting 5 seconds...
[2025-08-19T08:11:47.027Z] [local] [INFO] [29/128] Starting fetch: Not Boring
[2025-08-19T08:11:47.271Z] [local] [INFO] ✅ Not Boring: 20 items, 10 new articles
[2025-08-19T08:11:47.271Z] [local] [INFO] ⏱ Waiting 5 seconds...
[2025-08-19T08:11:52.272Z] [local] [INFO] [30/128] Starting fetch: n+1
[2025-08-19T08:11:55.233Z] [local] [INFO] ✅ n+1: 200 items, 10 new articles
[2025-08-19T08:11:55.233Z] [local] [INFO] ⏱ Waiting 5 seconds...
[2025-08-19T08:12:00.236Z] [local] [INFO] [31/128] Starting fetch: Pens and Poison
[2025-08-19T08:12:00.669Z] [local] [INFO] ✅ Pens and Poison: 20 items, 10 new articles
[2025-08-19T08:12:00.669Z] [local] [INFO] ⏱ Waiting 5 seconds...
[2025-08-19T08:12:05.671Z] [local] [INFO] [32/128] Starting fetch: Programmable Mutter
[2025-08-19T08:12:06.333Z] [local] [INFO] ✅ Programmable Mutter: 20 items, 10 new articles
[2025-08-19T08:12:06.333Z] [local] [INFO] ⏱ Waiting 5 seconds...
[2025-08-19T08:12:11.334Z] [local] [INFO] [33/128] Starting fetch: Quanta Magazine
[2025-08-19T08:12:12.518Z] [local] [INFO] ✅ Quanta Magazine: 5 items, 5 new articles
[2025-08-19T08:12:12.519Z] [local] [INFO] ⏱ Waiting 5 seconds...
[2025-08-19T08:12:17.519Z] [local] [INFO] [34/128] Starting fetch: Slow Boring
[2025-08-19T08:12:18.070Z] [local] [INFO] ✅ Slow Boring: 20 items, 10 new articles
[2025-08-19T08:12:18.070Z] [local] [INFO] ⏱ Waiting 5 seconds...
[2025-08-19T08:12:23.072Z] [local] [INFO] [35/128] Starting fetch: Sustainability by Numbers
[2025-08-19T08:12:23.385Z] [local] [INFO] ✅ Sustainability by Numbers: 20 items, 10 new articles
[2025-08-19T08:12:23.385Z] [local] [INFO] ⏱ Waiting 5 seconds...
[2025-08-19T08:12:28.386Z] [local] [INFO] [36/128] Starting fetch: The Marginalian
[2025-08-19T08:12:30.165Z] [local] [INFO] ✅ The Marginalian: 20 items, 10 new articles
[2025-08-19T08:12:30.166Z] [local] [INFO] ⏱ Waiting 5 seconds...
[2025-08-19T08:12:35.167Z] [local] [INFO] [37/128] Starting fetch: Woman of Letters
[2025-08-19T08:12:35.685Z] [local] [INFO] ✅ Woman of Letters: 20 items, 10 new articles
[2025-08-19T08:12:35.685Z] [local] [INFO] ⏱ Waiting 5 seconds...
[2025-08-19T08:12:40.686Z] [local] [INFO] [38/128] Starting fetch: Works in Progress
[2025-08-19T08:12:41.294Z] [local] [INFO] ✅ Works in Progress: 20 items, 10 new articles
[2025-08-19T08:12:41.294Z] [local] [INFO] ⏱ Waiting 5 seconds...
[2025-08-19T08:12:46.295Z] [local] [INFO] [39/128] Starting fetch: Letters of Note
[2025-08-19T08:12:51.472Z] [local] [INFO] ✅ Letters of Note: 20 items, 10 new articles
[2025-08-19T08:12:51.472Z] [local] [INFO] ⏱ Waiting 5 seconds...
[2025-08-19T08:12:56.473Z] [local] [INFO] [40/128] Starting fetch: Vik's Newsletter
[2025-08-19T08:12:57.514Z] [local] [INFO] ✅ Vik's Newsletter: 20 items, 10 new articles
[2025-08-19T08:12:57.514Z] [local] [INFO] ⏱ Waiting 5 seconds...
[2025-08-19T08:13:02.515Z] [local] [INFO] [41/128] Starting fetch: The Algorithmic Bridge
[2025-08-19T08:13:02.733Z] [local] [INFO] ✅ The Algorithmic Bridge: 20 items, 10 new articles
[2025-08-19T08:13:02.733Z] [local] [INFO] ⏱ Waiting 5 seconds...
[2025-08-19T08:13:07.733Z] [local] [INFO] [42/128] Starting fetch: The Culturist
[2025-08-19T08:13:08.758Z] [local] [INFO] ✅ The Culturist: 20 items, 10 new articles
[2025-08-19T08:13:08.758Z] [local] [INFO] ⏱ Waiting 5 seconds...
[2025-08-19T08:13:13.758Z] [local] [INFO] [43/128] Starting fetch: Nadig
[2025-08-19T08:13:13.987Z] [local] [INFO] ✅ Nadig: 20 items, 10 new articles
[2025-08-19T08:13:13.987Z] [local] [INFO] ⏱ Waiting 5 seconds...
[2025-08-19T08:13:18.987Z] [local] [INFO] [44/128] Starting fetch: Blood in the Machine
[2025-08-19T08:13:19.238Z] [local] [INFO] ✅ Blood in the Machine: 20 items, 10 new articles
[2025-08-19T08:13:19.238Z] [local] [INFO] ⏱ Waiting 5 seconds...
[2025-08-19T08:13:24.238Z] [local] [INFO] [45/128] Starting fetch: Jacob Silverman
[2025-08-19T08:13:24.707Z] [local] [INFO] ✅ Jacob Silverman: 20 items, 10 new articles
[2025-08-19T08:13:24.707Z] [local] [INFO] ⏱ Waiting 5 seconds...
[2025-08-19T08:13:29.707Z] [local] [INFO] [46/128] Starting fetch: The Present Age
[2025-08-19T08:13:31.078Z] [local] [INFO] ✅ The Present Age: 20 items, 10 new articles
[2025-08-19T08:13:31.078Z] [local] [INFO] ⏱ Waiting 5 seconds...
[2025-08-19T08:13:36.078Z] [local] [INFO] [47/128] Starting fetch: Pluralistic
[2025-08-19T08:13:39.983Z] [local] [INFO] ✅ Pluralistic: 10 items, 10 new articles
[2025-08-19T08:13:39.983Z] [local] [INFO] ⏱ Waiting 5 seconds...
[2025-08-19T08:13:44.984Z] [local] [INFO] [48/128] Starting fetch: Nintil
[2025-08-19T08:13:45.988Z] [local] [INFO] ✅ Nintil: 30 items, 10 new articles
[2025-08-19T08:13:45.988Z] [local] [INFO] ⏱ Waiting 5 seconds...
[2025-08-19T08:13:50.988Z] [local] [INFO] [49/128] Starting fetch: Maggie Appleton
[2025-08-19T08:13:51.207Z] [local] [INFO] ✅ Maggie Appleton: 136 items, 10 new articles
[2025-08-19T08:13:51.207Z] [local] [INFO] ⏱ Waiting 5 seconds...
[2025-08-19T08:13:56.206Z] [local] [INFO] [50/128] Starting fetch: Interconnected
[2025-08-19T08:13:58.276Z] [local] [INFO] ✅ Interconnected: 8 items, 8 new articles
[2025-08-19T08:13:58.276Z] [local] [INFO] ⏱ Waiting 5 seconds...
[2025-08-19T08:14:03.277Z] [local] [INFO] [51/128] Starting fetch: 3 Quarks Daily
[2025-08-19T08:14:04.950Z] [local] [INFO] ✅ 3 Quarks Daily: 20 items, 10 new articles
[2025-08-19T08:14:04.950Z] [local] [INFO] ⏱ Waiting 5 seconds...
[2025-08-19T08:14:09.952Z] [local] [INFO] [52/128] Starting fetch: Naked Capitalism
[2025-08-19T08:14:11.718Z] [local] [INFO] ✅ Naked Capitalism: 10 items, 10 new articles
[2025-08-19T08:14:11.718Z] [local] [INFO] ⏱ Waiting 5 seconds...
[2025-08-19T08:14:16.719Z] [local] [INFO] [53/128] Starting fetch: Law and Political Economy
[2025-08-19T08:14:19.435Z] [local] [INFO] ✅ Law and Political Economy: 10 items, 10 new articles
[2025-08-19T08:14:19.435Z] [local] [INFO] ⏱ Waiting 5 seconds...
[2025-08-19T08:14:24.435Z] [local] [INFO] [54/128] Starting fetch: Developing Economics
[2025-08-19T08:14:25.842Z] [local] [INFO] ✅ Developing Economics: 10 items, 10 new articles
[2025-08-19T08:14:25.842Z] [local] [INFO] ⏱ Waiting 5 seconds...
[2025-08-19T08:14:30.843Z] [local] [INFO] [55/128] Starting fetch: 1000 Word Philosophy
[2025-08-19T08:14:31.803Z] [local] [INFO] ✅ 1000 Word Philosophy: 10 items, 10 new articles
[2025-08-19T08:14:31.803Z] [local] [INFO] ⏱ Waiting 5 seconds...
[2025-08-19T08:14:36.804Z] [local] [INFO] [56/128] Starting fetch: Arts & Letters Daily
[2025-08-19T08:14:37.908Z] [local] [INFO] Retrying Arts & Letters Daily in 30s (attempt 2)
[2025-08-19T08:15:08.767Z] [local] [INFO] Retrying Arts & Letters Daily in 60s (attempt 3)
[2025-08-19T08:16:09.608Z] [local] [ERROR] ❌ Arts & Letters Daily: Status code 403
[2025-08-19T08:16:09.608Z] [local] [INFO] ⏱ Waiting 5 seconds...
[2025-08-19T08:16:14.609Z] [local] [INFO] [57/128] Starting fetch: Kottke.org
[2025-08-19T08:16:16.774Z] [local] [INFO] ✅ Kottke.org: 60 items, 10 new articles
[2025-08-19T08:16:16.774Z] [local] [INFO] ⏱ Waiting 5 seconds...
[2025-08-19T08:16:21.776Z] [local] [INFO] [58/128] Starting fetch: Reasons to be Cheerful
[2025-08-19T08:16:23.947Z] [local] [INFO] ✅ Reasons to be Cheerful: 10 items, 10 new articles
[2025-08-19T08:16:23.947Z] [local] [INFO] ⏱ Waiting 5 seconds...
[2025-08-19T08:16:28.950Z] [local] [INFO] [59/128] Starting fetch: Sentiers
[2025-08-19T08:16:30.233Z] [local] [INFO] ✅ Sentiers: 15 items, 10 new articles
[2025-08-19T08:16:30.233Z] [local] [INFO] ⏱ Waiting 5 seconds...
[2025-08-19T08:16:35.234Z] [local] [INFO] [60/128] Starting fetch: Ironic Sans
[2025-08-19T08:16:35.636Z] [local] [INFO] ✅ Ironic Sans: 15 items, 10 new articles
[2025-08-19T08:16:35.636Z] [local] [INFO] ⏱ Waiting 5 seconds...
[2025-08-19T08:16:40.636Z] [local] [INFO] [61/128] Starting fetch: Today in Tabs
[2025-08-19T08:16:48.126Z] [local] [INFO] Retrying Today in Tabs in 30s (attempt 2)
[2025-08-19T08:17:20.411Z] [local] [INFO] Retrying Today in Tabs in 60s (attempt 3)
[2025-08-19T08:18:22.313Z] [local] [ERROR] ❌ Today in Tabs: Invalid character in entity name
Line: 107
Column: 938
Char: &
[2025-08-19T08:18:22.313Z] [local] [INFO] ⏱ Waiting 5 seconds...
[2025-08-19T08:18:27.314Z] [local] [INFO] [62/128] Starting fetch: On Focus
[2025-08-19T08:18:29.054Z] [local] [INFO] ✅ On Focus: 12 items, 10 new articles
[2025-08-19T08:18:29.054Z] [local] [INFO] ⏱ Waiting 5 seconds...
[2025-08-19T08:18:34.055Z] [local] [INFO] [63/128] Starting fetch: Robin Sloan
[2025-08-19T08:18:34.682Z] [local] [INFO] ✅ Robin Sloan: 20 items, 10 new articles
[2025-08-19T08:18:34.682Z] [local] [INFO] ⏱ Waiting 5 seconds...
[2025-08-19T08:18:39.683Z] [local] [INFO] [64/128] Starting fetch: Tedium
[2025-08-19T08:18:40.832Z] [local] [INFO] ✅ Tedium: 10 items, 10 new articles
[2025-08-19T08:18:40.832Z] [local] [INFO] ⏱ Waiting 5 seconds...
[2025-08-19T08:18:45.833Z] [local] [INFO] [65/128] Starting fetch: Chris Glass
[2025-08-19T08:18:47.274Z] [local] [INFO] ✅ Chris Glass: 20 items, 10 new articles
[2025-08-19T08:18:47.274Z] [local] [INFO] ⏱ Waiting 5 seconds...
[2025-08-19T08:18:52.275Z] [local] [INFO] [66/128] Starting fetch: Abnormal Returns
[2025-08-19T08:18:53.884Z] [local] [INFO] ✅ Abnormal Returns: 14 items, 10 new articles
[2025-08-19T08:18:53.884Z] [local] [INFO] ⏱ Waiting 5 seconds...
[2025-08-19T08:18:58.885Z] [local] [INFO] [67/128] Starting fetch: A Wealth of Common Sense
[2025-08-19T08:18:59.146Z] [local] [INFO] ✅ A Wealth of Common Sense: 10 items, 10 new articles
[2025-08-19T08:18:59.146Z] [local] [INFO] ⏱ Waiting 5 seconds...
[2025-08-19T08:19:04.147Z] [local] [INFO] [68/128] Starting fetch: Meb Faber Research
[2025-08-19T08:19:06.250Z] [local] [INFO] ✅ Meb Faber Research: 20 items, 10 new articles
[2025-08-19T08:19:06.250Z] [local] [INFO] ⏱ Waiting 5 seconds...
[2025-08-19T08:19:11.251Z] [local] [INFO] [69/128] Starting fetch: The Idea Farm
[2025-08-19T08:19:19.640Z] [local] [INFO] ✅ The Idea Farm: 20 items, 10 new articles
[2025-08-19T08:19:19.640Z] [local] [INFO] ⏱ Waiting 5 seconds...
[2025-08-19T08:19:24.641Z] [local] [INFO] [70/128] Starting fetch: Campaign Archive Newsletter
[2025-08-19T08:19:25.573Z] [local] [INFO] ✅ Campaign Archive Newsletter: 10 items, 10 new articles
[2025-08-19T08:19:25.573Z] [local] [INFO] ⏱ Waiting 5 seconds...
[2025-08-19T08:19:30.573Z] [local] [INFO] [71/128] Starting fetch: Meb Faber
[2025-08-19T08:19:31.919Z] [local] [INFO] ✅ Meb Faber: 10 items, 10 new articles
[2025-08-19T08:19:31.919Z] [local] [INFO] ⏱ Waiting 5 seconds...
[2025-08-19T08:19:36.920Z] [local] [INFO] [72/128] Starting fetch: Grist
[2025-08-19T08:19:37.744Z] [local] [INFO] ✅ Grist: 20 items, 10 new articles
[2025-08-19T08:19:37.744Z] [local] [INFO] ⏱ Waiting 5 seconds...
[2025-08-19T08:19:42.745Z] [local] [INFO] [73/128] Starting fetch: Carbon Brief
[2025-08-19T08:19:43.016Z] [local] [INFO] ✅ Carbon Brief: 10 items, 10 new articles
[2025-08-19T08:19:43.016Z] [local] [INFO] ⏱ Waiting 5 seconds...
[2025-08-19T08:19:48.016Z] [local] [INFO] [74/128] Starting fetch: MIT Press Reader
[2025-08-19T08:19:50.365Z] [local] [INFO] ✅ MIT Press Reader: 20 items, 10 new articles
[2025-08-19T08:19:50.365Z] [local] [INFO] ⏱ Waiting 5 seconds...
[2025-08-19T08:19:55.366Z] [local] [INFO] [75/128] Starting fetch: Foreign Affairs
[2025-08-19T08:19:55.610Z] [local] [INFO] ✅ Foreign Affairs: 20 items, 10 new articles
[2025-08-19T08:19:55.610Z] [local] [INFO] ⏱ Waiting 5 seconds...
[2025-08-19T08:20:00.611Z] [local] [INFO] [76/128] Starting fetch: Adam Tooze
[2025-08-19T08:20:01.224Z] [local] [INFO] ✅ Adam Tooze: 20 items, 10 new articles
[2025-08-19T08:20:01.224Z] [local] [INFO] ⏱ Waiting 76 seconds...
[2025-08-19T08:21:16.979Z] [local] [INFO] [77/128] Starting fetch: AI Log Blog
[2025-08-19T08:21:19.384Z] [local] [INFO] ✅ AI Log Blog: 20 items, 10 new articles
[2025-08-19T08:21:19.384Z] [local] [INFO] ⏱ Waiting 53 seconds...
[2025-08-19T08:22:12.840Z] [local] [INFO] [78/128] Starting fetch: Aswath Damodaran
[2025-08-19T08:22:13.943Z] [local] [INFO] ✅ Aswath Damodaran: 20 items, 10 new articles
[2025-08-19T08:22:13.943Z] [local] [INFO] ⏱ Waiting 89 seconds...
[2025-08-19T08:23:42.534Z] [local] [INFO] [79/128] Starting fetch: Back of Mind
[2025-08-19T08:23:42.883Z] [local] [INFO] ✅ Back of Mind: 20 items, 10 new articles
[2025-08-19T08:23:42.883Z] [local] [INFO] ⏱ Waiting 49 seconds...
[2025-08-19T08:24:32.259Z] [local] [INFO] [80/128] Starting fetch: Bentham's Newsletter
[2025-08-19T08:24:33.472Z] [local] [INFO] ✅ Bentham's Newsletter: 20 items, 10 new articles
[2025-08-19T08:24:33.472Z] [local] [INFO] ⏸ Taking a 5 minute break after 5 Substack feeds...
[2025-08-19T08:24:33.472Z] [local] [INFO] ⏱ Waiting 300 seconds...
[2025-08-19T08:29:33.498Z] [local] [INFO] [81/128] Starting fetch: Brad DeLong
[2025-08-19T08:29:34.480Z] [local] [INFO] ✅ Brad DeLong: 20 items, 10 new articles
[2025-08-19T08:29:34.480Z] [local] [INFO] ⏱ Waiting 36 seconds...
[2025-08-19T08:30:10.920Z] [local] [INFO] [82/128] Starting fetch: Branko Milanovic
[2025-08-19T08:30:12.207Z] [local] [INFO] ✅ Branko Milanovic: 20 items, 10 new articles
[2025-08-19T08:30:12.207Z] [local] [INFO] ⏱ Waiting 84 seconds...
[2025-08-19T08:31:36.627Z] [local] [INFO] [83/128] Starting fetch: Brink Lindsey
[2025-08-19T08:31:38.090Z] [local] [INFO] ✅ Brink Lindsey: 20 items, 10 new articles
[2025-08-19T08:31:38.090Z] [local] [INFO] ⏱ Waiting 76 seconds...
[2025-08-19T08:32:54.347Z] [local] [INFO] [84/128] Starting fetch: Calhoun
[2025-08-19T08:32:55.049Z] [local] [INFO] ✅ Calhoun: 1 items, 1 new articles
[2025-08-19T08:32:55.049Z] [local] [INFO] ⏱ Waiting 61 seconds...
[2025-08-19T08:33:56.244Z] [local] [INFO] [85/128] Starting fetch: Dave Karpf
[2025-08-19T08:33:56.978Z] [local] [INFO] ✅ Dave Karpf: 20 items, 10 new articles
[2025-08-19T08:33:56.978Z] [local] [INFO] ⏸ Taking a 5 minute break after 10 Substack feeds...
[2025-08-19T08:33:56.978Z] [local] [INFO] ⏱ Waiting 300 seconds...
[2025-08-19T08:38:57.011Z] [local] [INFO] [86/128] Starting fetch: Erik Hoel
[2025-08-19T08:38:58.680Z] [local] [INFO] ✅ Erik Hoel: 20 items, 10 new articles
[2025-08-19T08:38:58.680Z] [local] [INFO] ⏱ Waiting 59 seconds...
[2025-08-19T08:39:57.680Z] [local] [INFO] [87/128] Starting fetch: Freddie deBoer
[2025-08-19T08:39:58.426Z] [local] [INFO] ✅ Freddie deBoer: 20 items, 10 new articles
[2025-08-19T08:39:58.426Z] [local] [INFO] ⏱ Waiting 58 seconds...
[2025-08-19T08:40:56.832Z] [local] [INFO] [88/128] Starting fetch: Gaby del Valle
[2025-08-19T08:40:57.404Z] [local] [INFO] ✅ Gaby del Valle: 20 items, 10 new articles
[2025-08-19T08:40:57.404Z] [local] [INFO] ⏱ Waiting 65 seconds...
[2025-08-19T08:42:02.111Z] [local] [INFO] [89/128] Starting fetch: Gary Marcus
[2025-08-19T08:42:02.382Z] [local] [INFO] ✅ Gary Marcus: 20 items, 10 new articles
[2025-08-19T08:42:02.382Z] [local] [INFO] ⏱ Waiting 56 seconds...
[2025-08-19T08:42:57.966Z] [local] [INFO] [90/128] Starting fetch: Hollis Robbins
[2025-08-19T08:42:59.182Z] [local] [INFO] ✅ Hollis Robbins: 20 items, 10 new articles
[2025-08-19T08:42:59.182Z] [local] [INFO] ⏸ Taking a 5 minute break after 15 Substack feeds...
[2025-08-19T08:42:59.182Z] [local] [INFO] ⏱ Waiting 300 seconds...
[2025-08-19T08:47:59.202Z] [local] [INFO] [91/128] Starting fetch: Justin E.H. Smith
[2025-08-19T08:48:01.965Z] [local] [INFO] ✅ Justin E.H. Smith: 20 items, 10 new articles
[2025-08-19T08:48:01.965Z] [local] [INFO] ⏱ Waiting 71 seconds...
[2025-08-19T08:49:13.266Z] [local] [INFO] [92/128] Starting fetch: MAPUC
[2025-08-19T08:49:13.836Z] [local] [INFO] ✅ MAPUC: 19 items, 10 new articles
[2025-08-19T08:49:13.836Z] [local] [INFO] ⏱ Waiting 56 seconds...
[2025-08-19T08:50:09.566Z] [local] [INFO] [93/128] Starting fetch: Max Read
[2025-08-19T08:50:10.450Z] [local] [INFO] ✅ Max Read: 20 items, 10 new articles
[2025-08-19T08:50:10.450Z] [local] [INFO] ⏱ Waiting 69 seconds...
[2025-08-19T08:51:19.435Z] [local] [INFO] [94/128] Starting fetch: Meghan O'Rourke
[2025-08-19T08:51:20.020Z] [local] [INFO] ✅ Meghan O'Rourke: 20 items, 10 new articles
[2025-08-19T08:51:20.020Z] [local] [INFO] ⏱ Waiting 39 seconds...
[2025-08-19T08:51:59.156Z] [local] [INFO] [95/128] Starting fetch: Michael Nielsen
[2025-08-19T08:52:00.254Z] [local] [INFO] ✅ Michael Nielsen: 1 items, 1 new articles
[2025-08-19T08:52:00.254Z] [local] [INFO] ⏸ Taking a 5 minute break after 20 Substack feeds...
[2025-08-19T08:52:00.254Z] [local] [INFO] ⏱ Waiting 300 seconds...
[2025-08-19T08:57:00.309Z] [local] [INFO] [96/128] Starting fetch: Moral Law Within
[2025-08-19T08:57:01.412Z] [local] [INFO] ✅ Moral Law Within: 20 items, 10 new articles
[2025-08-19T08:57:01.412Z] [local] [INFO] ⏱ Waiting 84 seconds...
[2025-08-19T08:58:25.500Z] [local] [INFO] [97/128] Starting fetch: Mutiny
[2025-08-19T08:58:26.556Z] [local] [INFO] ✅ Mutiny: 1 items, 1 new articles
[2025-08-19T08:58:26.556Z] [local] [INFO] ⏱ Waiting 57 seconds...
[2025-08-19T08:59:23.692Z] [local] [INFO] [98/128] Starting fetch: Nicholas Decker
[2025-08-19T08:59:24.538Z] [local] [INFO] ✅ Nicholas Decker: 20 items, 10 new articles
[2025-08-19T08:59:24.538Z] [local] [INFO] ⏱ Waiting 30 seconds...
[2025-08-19T08:59:54.805Z] [local] [INFO] [99/128] Starting fetch: Nick Timothy
[2025-08-19T08:59:57.118Z] [local] [INFO] ✅ Nick Timothy: 10 items, 10 new articles
[2025-08-19T08:59:57.118Z] [local] [INFO] ⏱ Waiting 65 seconds...
[2025-08-19T09:01:01.737Z] [local] [INFO] [100/128] Starting fetch: Nils Gilman
[2025-08-19T09:01:03.177Z] [local] [INFO] ✅ Nils Gilman: 20 items, 10 new articles
[2025-08-19T09:01:03.177Z] [local] [INFO] ⏸ Taking a 5 minute break after 25 Substack feeds...
[2025-08-19T09:01:03.177Z] [local] [INFO] ⏱ Waiting 300 seconds...
[2025-08-19T09:06:03.225Z] [local] [INFO] [101/128] Starting fetch: Over the Field
[2025-08-19T09:06:04.121Z] [local] [INFO] ✅ Over the Field: 20 items, 10 new articles
[2025-08-19T09:06:04.122Z] [local] [INFO] ⏱ Waiting 84 seconds...
[2025-08-19T09:07:28.441Z] [local] [INFO] [102/128] Starting fetch: Patrick House
[2025-08-19T09:07:29.657Z] [local] [INFO] ✅ Patrick House: 0 items, 0 new articles
[2025-08-19T09:07:29.657Z] [local] [INFO] ⏱ Waiting 54 seconds...
[2025-08-19T09:08:24.192Z] [local] [INFO] [103/128] Starting fetch: Paul Krugman
[2025-08-19T09:08:25.581Z] [local] [INFO] ✅ Paul Krugman: 20 items, 10 new articles
[2025-08-19T09:08:25.581Z] [local] [INFO] ⏱ Waiting 75 seconds...
[2025-08-19T09:09:40.567Z] [local] [INFO] [104/128] Starting fetch: Philosopher's Beard
[2025-08-19T09:09:41.739Z] [local] [INFO] ✅ Philosopher's Beard: 6 items, 6 new articles
[2025-08-19T09:09:41.739Z] [local] [INFO] ⏱ Waiting 56 seconds...
[2025-08-19T09:10:37.339Z] [local] [INFO] [105/128] Starting fetch: Philosophy Portal
[2025-08-19T09:10:39.628Z] [local] [INFO] ✅ Philosophy Portal: 20 items, 10 new articles
[2025-08-19T09:10:39.628Z] [local] [INFO] ⏸ Taking a 5 minute break after 30 Substack feeds...
[2025-08-19T09:10:39.628Z] [local] [INFO] ⏱ Waiting 300 seconds...
[2025-08-19T09:15:39.726Z] [local] [INFO] [106/128] Starting fetch: Plumpits
[2025-08-19T09:15:40.689Z] [local] [INFO] ✅ Plumpits: 20 items, 10 new articles
[2025-08-19T09:15:40.689Z] [local] [INFO] ⏱ Waiting 56 seconds...
[2025-08-19T09:16:36.601Z] [local] [INFO] [107/128] Starting fetch: Marc Andreessen
[2025-08-19T09:16:36.830Z] [local] [INFO] ✅ Marc Andreessen: 15 items, 10 new articles
[2025-08-19T09:16:36.830Z] [local] [INFO] ⏱ Waiting 43 seconds...
[2025-08-19T09:17:19.478Z] [local] [INFO] [108/128] Starting fetch: Public Policy
[2025-08-19T09:17:19.722Z] [local] [INFO] ✅ Public Policy: 20 items, 10 new articles
[2025-08-19T09:17:19.722Z] [local] [INFO] ⏱ Waiting 63 seconds...
[2025-08-19T09:18:23.102Z] [local] [INFO] [109/128] Starting fetch: Res Obscura
[2025-08-19T09:18:23.351Z] [local] [INFO] ✅ Res Obscura: 20 items, 10 new articles
[2025-08-19T09:18:23.351Z] [local] [INFO] ⏱ Waiting 38 seconds...
[2025-08-19T09:19:01.089Z] [local] [INFO] [110/128] Starting fetch: Richard Hanania
[2025-08-19T09:19:04.490Z] [local] [INFO] ✅ Richard Hanania: 20 items, 10 new articles
[2025-08-19T09:19:04.490Z] [local] [INFO] ⏸ Taking a 5 minute break after 35 Substack feeds...
[2025-08-19T09:19:04.490Z] [local] [INFO] ⏱ Waiting 300 seconds...
[2025-08-19T09:24:04.568Z] [local] [INFO] [111/128] Starting fetch: Rob Henderson
[2025-08-19T09:24:06.287Z] [local] [INFO] ✅ Rob Henderson: 20 items, 10 new articles
[2025-08-19T09:24:06.287Z] [local] [INFO] ⏱ Waiting 36 seconds...
[2025-08-19T09:24:41.942Z] [local] [INFO] [112/128] Starting fetch: Rohan Venkat
[2025-08-19T09:24:42.881Z] [local] [INFO] ✅ Rohan Venkat: 20 items, 10 new articles
[2025-08-19T09:24:42.881Z] [local] [INFO] ⏱ Waiting 52 seconds...
[2025-08-19T09:25:35.114Z] [local] [INFO] [113/128] Starting fetch: Rotten and Good
[2025-08-19T09:25:36.137Z] [local] [INFO] ✅ Rotten and Good: 20 items, 10 new articles
[2025-08-19T09:25:36.137Z] [local] [INFO] ⏱ Waiting 33 seconds...
[2025-08-19T09:26:09.246Z] [local] [INFO] [114/128] Starting fetch: School of the Unconformed
[2025-08-19T09:26:10.860Z] [local] [INFO] ✅ School of the Unconformed: 20 items, 10 new articles
[2025-08-19T09:26:10.860Z] [local] [INFO] ⏱ Waiting 83 seconds...
[2025-08-19T09:27:33.908Z] [local] [INFO] [115/128] Starting fetch: Sean Patrick Hughes
[2025-08-19T09:27:34.855Z] [local] [INFO] ✅ Sean Patrick Hughes: 20 items, 10 new articles
[2025-08-19T09:27:34.855Z] [local] [INFO] ⏸ Taking a 5 minute break after 40 Substack feeds...
[2025-08-19T09:27:34.855Z] [local] [INFO] ⏱ Waiting 300 seconds...
[2025-08-19T09:32:34.955Z] [local] [INFO] [116/128] Starting fetch: Shreya Rajagopalan
[2025-08-19T09:32:35.251Z] [local] [INFO] ✅ Shreya Rajagopalan: 16 items, 10 new articles
[2025-08-19T09:32:35.251Z] [local] [INFO] ⏱ Waiting 77 seconds...
[2025-08-19T09:33:52.148Z] [local] [INFO] [117/128] Starting fetch: The Diff
[2025-08-19T09:33:53.216Z] [local] [INFO] ✅ The Diff: 1 items, 1 new articles
[2025-08-19T09:33:53.216Z] [local] [INFO] ⏱ Waiting 74 seconds...
[2025-08-19T09:35:07.181Z] [local] [INFO] [118/128] Starting fetch: The Unhappy Man
[2025-08-19T09:35:08.242Z] [local] [INFO] ✅ The Unhappy Man: 20 items, 10 new articles
[2025-08-19T09:35:08.242Z] [local] [INFO] ⏱ Waiting 65 seconds...
[2025-08-19T09:36:12.856Z] [local] [INFO] [119/128] Starting fetch: The Upheaval
[2025-08-19T09:36:14.737Z] [local] [INFO] ✅ The Upheaval: 20 items, 10 new articles
[2025-08-19T09:36:14.737Z] [local] [INFO] ⏱ Waiting 46 seconds...
[2025-08-19T09:37:00.524Z] [local] [INFO] [120/128] Starting fetch: Tom Chivers
[2025-08-19T09:37:01.513Z] [local] [INFO] ✅ Tom Chivers: 1 items, 1 new articles
[2025-08-19T09:37:01.513Z] [local] [INFO] ⏸ Taking a 5 minute break after 45 Substack feeds...
[2025-08-19T09:37:01.513Z] [local] [INFO] ⏱ Waiting 300 seconds...
[2025-08-19T09:42:01.614Z] [local] [INFO] [121/128] Starting fetch: Useful Fictions
[2025-08-19T09:42:02.391Z] [local] [INFO] ✅ Useful Fictions: 19 items, 10 new articles
[2025-08-19T09:42:02.391Z] [local] [INFO] ⏱ Waiting 64 seconds...
[2025-08-19T09:43:06.191Z] [local] [INFO] [122/128] Starting fetch: Visa Kanv
[2025-08-19T09:43:08.228Z] [local] [INFO] ✅ Visa Kanv: 20 items, 10 new articles
[2025-08-19T09:43:08.228Z] [local] [INFO] ⏱ Waiting 33 seconds...
[2025-08-19T09:43:40.959Z] [local] [INFO] [123/128] Starting fetch: Gregory B. Sadler
[2025-08-19T09:43:41.742Z] [local] [INFO] ✅ Gregory B. Sadler: 20 items, 10 new articles
[2025-08-19T09:43:41.742Z] [local] [INFO] ⏱ Waiting 39 seconds...
[2025-08-19T09:44:20.431Z] [local] [INFO] [124/128] Starting fetch: Figs in Winter
[2025-08-19T09:44:21.288Z] [local] [INFO] ✅ Figs in Winter: 20 items, 10 new articles
[2025-08-19T09:44:21.289Z] [local] [INFO] ⏱ Waiting 84 seconds...
[2025-08-19T09:45:45.317Z] [local] [INFO] [125/128] Starting fetch: Larry Swedroe
[2025-08-19T09:45:45.938Z] [local] [INFO] ✅ Larry Swedroe: 20 items, 10 new articles
[2025-08-19T09:45:45.938Z] [local] [INFO] ⏸ Taking a 5 minute break after 50 Substack feeds...
[2025-08-19T09:45:45.938Z] [local] [INFO] ⏱ Waiting 300 seconds...
[2025-08-19T09:50:45.939Z] [local] [INFO] [126/128] Starting fetch: Anne Applebaum
[2025-08-19T09:50:46.918Z] [local] [INFO] ✅ Anne Applebaum: 20 items, 10 new articles
[2025-08-19T09:50:46.918Z] [local] [INFO] ⏱ Waiting 67 seconds...
[2025-08-19T09:51:54.186Z] [local] [INFO] [127/128] Starting fetch: Phillips P. O'Brien
[2025-08-19T09:51:55.718Z] [local] [INFO] ✅ Phillips P. O'Brien: 20 items, 10 new articles
[2025-08-19T09:51:55.718Z] [local] [INFO] ⏱ Waiting 87 seconds...
[2025-08-19T09:53:22.595Z] [local] [INFO] [128/128] Starting fetch: Overcoming Bias
[2025-08-19T09:53:24.389Z] [local] [INFO] ✅ Overcoming Bias: 20 items, 10 new articles
[2025-08-19T09:53:24.448Z] [local] [INFO] ==================================================
[2025-08-19T09:53:24.448Z] [local] [INFO] SUMMARY - LOCAL
[2025-08-19T09:53:24.448Z] [local] [INFO] Runtime: 105.8 minutes
[2025-08-19T09:53:24.448Z] [local] [INFO] Total Success: 125/128 (98%)
[2025-08-19T09:53:24.448Z] [local] [INFO] Non-Substack: 125/128
[2025-08-19T09:53:24.448Z] [local] [INFO] Substack: 0/0 (0%)
[2025-08-19T09:53:24.448Z] [local] [INFO] New Articles: 1181
[2025-08-19T09:53:24.448Z] [local] [INFO] Errors: 0
[2025-08-19T09:53:24.448Z] [local] [INFO] Failed Feeds: Garbage Day, Arts & Letters Daily, Today in Tabs
[2025-08-19T09:53:24.448Z] [local] [INFO] ==================================================
[2025-08-19T09:53:24.449Z] [local] [INFO] 📝 Summary saved to: /home/bhuvanesh/paper trails/logs/local-2025-08-19.json
[2025-08-19T09:53:24.449Z] [local] [INFO] === Pushing to Git ===
[2025-08-19T09:53:24.655Z] [local] [INFO] ✅ Git commit: Changes committed
[2025-08-19T09:53:28.746Z] [local] [INFO] ✅ Git push: Successfully pushed to remote
[2025-08-19T09:53:28.746Z] [local] [INFO] ✓ All done! Site will be updated on next deploy.
